{
  "$schema": "https://json-schema.org/draft/2020-12/schema",
  "title": "Kiln Work Order",
  "type": "object",
  "required": ["work_order_id", "workload", "requirement", "acceptance"],
  "properties": {
    "work_order_id": {"type": "string", "pattern": "^WO-[A-Z0-9-]+$"},
    "workload": {"type": "string", "minLength": 1},
    "requirement": {"type": "string", "minLength": 1},
    "acceptance": {"type": "array", "items": {"type": "string"}, "minItems": 1},
    "constraints": {"type": "array", "items": {"type": "string"}},
    "evidence_required": {"type": "array", "items": {"type": "string"}}
  },
  "additionalProperties": false
}
